{"artifact_id":"reiyah.perception-revision.audit-request","comparison_id":"synthetic-independent-replacement","deletion_budget":1,"family":"reference_deletions","observation_basis":"hypothetical","observations":[{"anchor":"anchor-0","evidence_sha256":"e4765c9326d95cf5c11ca18385da1b8099339c3ab96a3e9e94b0180f4411b564","object":"object-0","outcome":"present"}],"reference_context_sha256":"5fe12d49dd66d499efc1944c92006402fa6edb18d6b92f8c74b24791f1921e09","version":"0.1.0"}
